{
  "$schema": "../../artifacts/auth.schema.json",
  "artifactType": "auth.schema",
  "version": "1.0.0",
  "metadata": {
    "generatedBy": "ai.authentication-agent",
    "generatedAt": "2026-01-15T10:15:00Z",
    "projectName": "acme-shop",
    "sourceArtifacts": ["architecture.json"]
  },
  "data": {
    "strategy": "jwt",
    "tokenDelivery": "httpOnlyCookie",
    "accessTokenTtl": "15m",
    "refreshTokenTtl": "30d",
    "passwordHashing": "bcrypt",
    "saltRounds": 12,
    "roles": ["customer", "admin"],
    "protectedRouteConvention": "authMiddleware sets req.user (id, email, role); authorization.rbac's requireRole(...roles) reads req.user.role after it"
  }
}
