{
  "$schema": "../../artifacts/auth.schema.json",
  "artifactType": "auth.schema",
  "version": "1.0.0",
  "metadata": {
    "generatedBy": "ai.authentication-agent",
    "generatedAt": "2026-02-03T09:07:00Z",
    "projectName": "multi-tenant-saas",
    "sourceArtifacts": ["requirements.json", "architecture.json"]
  },
  "data": {
    "strategy": "jwt",
    "tokenDelivery": "httpOnlyCookie",
    "accessTokenTtl": "15m",
    "refreshTokenTtl": "14d",
    "passwordHashing": "bcrypt",
    "saltRounds": 12,
    "roles": ["member", "admin"],
    "protectedRouteConvention": "authMiddleware sets req.user.{id,role}; authorization.tenant-isolation additionally requires req.user.tenantId, enforced primarily at the repository query level (every projects/invoices query is scoped by tenant_id), with the middleware as defense-in-depth"
  }
}
